{
  "version": 1,
  "registryMode": "hand-authored-exact-scene-identities",
  "evidencePolicy": "fail-closed-real-built-artifact-only",
  "approvedHeadlessRoute": "cheap-lowlevel-headless",
  "surfaces": [
    "windows-desktop-application",
    "documentation-site"
  ],
  "destinations": [
    "home-default-light",
    "projects-default-light",
    "design-systems-default-light",
    "automations-default-light",
    "plugins-default-light",
    "integrations-default-light",
    "studio-default-light",
    "library-default-light",
    "settings-appearance-light",
    "handoff-default-light"
  ],
  "scenes": [
    {
      "id": "scene-windows-desktop-application-language-modes-change-language-mode",
      "surfaceId": "windows-desktop-application",
      "featureId": "language-modes",
      "destinationId": null,
      "status": "unreachable",
      "statusReason": "No current built artifact or runtime capture is recorded.",
      "tuple": {
        "screenId": "language-modes",
        "state": "before-after-interaction",
        "theme": "light",
        "locale": "en-US",
        "viewportWidth": 1440,
        "viewportHeight": 900,
        "displayScale": 1,
        "route": "feature/language-modes",
        "headlessRoute": "cheap-lowlevel-headless",
        "networkIsolation": {
          "mode": "capture-aware-disabled-network",
          "blockedExternalRequests": true,
          "allowedOrigins": [
            "loopback",
            "app-resource"
          ]
        }
      },
      "actionTarget": "language mode control",
      "accessibleName": "language mode control",
      "inputMethod": "pointer",
      "expectedBefore": "current language is visible",
      "expectedAfter": "selected language is applied across the surface"
    },
    {
      "id": "scene-windows-desktop-application-dialog-emoji-toggle-toggle-dialog-emojis",
      "surfaceId": "windows-desktop-application",
      "featureId": "dialog-emoji-toggle",
      "destinationId": null,
      "status": "unreachable",
      "statusReason": "No current built artifact or runtime capture is recorded.",
      "tuple": {
        "screenId": "dialog-emoji-toggle",
        "state": "before-after-interaction",
        "theme": "light",
        "locale": "en-US",
        "viewportWidth": 1440,
        "viewportHeight": 900,
        "displayScale": 1,
        "route": "feature/dialog-emoji-toggle",
        "headlessRoute": "cheap-lowlevel-headless",
        "networkIsolation": {
          "mode": "capture-aware-disabled-network",
          "blockedExternalRequests": true,
          "allowedOrigins": [
            "loopback",
            "app-resource"
          ]
        }
      },
      "actionTarget": "dialog emoji toggle",
      "accessibleName": "dialog emoji toggle",
      "inputMethod": "pointer",
      "expectedBefore": "toggle state is visible",
      "expectedAfter": "dialog decoration changes without changing factual copy"
    },
    {
      "id": "scene-windows-desktop-application-school-mode-enable-school-mode",
      "surfaceId": "windows-desktop-application",
      "featureId": "school-mode",
      "destinationId": null,
      "status": "unreachable",
      "statusReason": "No current built artifact or runtime capture is recorded.",
      "tuple": {
        "screenId": "school-mode",
        "state": "before-after-interaction",
        "theme": "light",
        "locale": "en-US",
        "viewportWidth": 1440,
        "viewportHeight": 900,
        "displayScale": 1,
        "route": "feature/school-mode",
        "headlessRoute": "cheap-lowlevel-headless",
        "networkIsolation": {
          "mode": "capture-aware-disabled-network",
          "blockedExternalRequests": true,
          "allowedOrigins": [
            "loopback",
            "app-resource"
          ]
        }
      },
      "actionTarget": "school mode toggle",
      "accessibleName": "school mode toggle",
      "inputMethod": "pointer",
      "expectedBefore": "mode is off",
      "expectedAfter": "mode is on and suppressed features are absent"
    },
    {
      "id": "scene-windows-desktop-application-narration-enable-narrator",
      "surfaceId": "windows-desktop-application",
      "featureId": "narration",
      "destinationId": null,
      "status": "unreachable",
      "statusReason": "No current built artifact or runtime capture is recorded.",
      "tuple": {
        "screenId": "narration",
        "state": "before-after-interaction",
        "theme": "light",
        "locale": "en-US",
        "viewportWidth": 1440,
        "viewportHeight": 900,
        "displayScale": 1,
        "route": "feature/narration",
        "headlessRoute": "cheap-lowlevel-headless",
        "networkIsolation": {
          "mode": "capture-aware-disabled-network",
          "blockedExternalRequests": true,
          "allowedOrigins": [
            "loopback",
            "app-resource"
          ]
        }
      },
      "actionTarget": "narrator toggle",
      "accessibleName": "narrator toggle",
      "inputMethod": "pointer",
      "expectedBefore": "narrator is off",
      "expectedAfter": "narrator is on with voice controls available"
    },
    {
      "id": "scene-windows-desktop-application-scheduled-settings-create-schedule",
      "surfaceId": "windows-desktop-application",
      "featureId": "scheduled-settings",
      "destinationId": null,
      "status": "unreachable",
      "statusReason": "No current built artifact or runtime capture is recorded.",
      "tuple": {
        "screenId": "scheduled-settings",
        "state": "before-after-interaction",
        "theme": "light",
        "locale": "en-US",
        "viewportWidth": 1440,
        "viewportHeight": 900,
        "displayScale": 1,
        "route": "feature/scheduled-settings",
        "headlessRoute": "cheap-lowlevel-headless",
        "networkIsolation": {
          "mode": "capture-aware-disabled-network",
          "blockedExternalRequests": true,
          "allowedOrigins": [
            "loopback",
            "app-resource"
          ]
        }
      },
      "actionTarget": "new schedule action",
      "accessibleName": "new schedule action",
      "inputMethod": "pointer",
      "expectedBefore": "schedule list is visible",
      "expectedAfter": "guided schedule editor is open"
    },
    {
      "id": "scene-windows-desktop-application-dim-sum-surprise-observe-startup-surprise",
      "surfaceId": "windows-desktop-application",
      "featureId": "dim-sum-surprise",
      "destinationId": null,
      "status": "unreachable",
      "statusReason": "No current built artifact or runtime capture is recorded.",
      "tuple": {
        "screenId": "dim-sum-surprise",
        "state": "before-after-interaction",
        "theme": "light",
        "locale": "en-US",
        "viewportWidth": 1440,
        "viewportHeight": 900,
        "displayScale": 1,
        "route": "feature/dim-sum-surprise",
        "headlessRoute": "cheap-lowlevel-headless",
        "networkIsolation": {
          "mode": "capture-aware-disabled-network",
          "blockedExternalRequests": true,
          "allowedOrigins": [
            "loopback",
            "app-resource"
          ]
        }
      },
      "actionTarget": "launch application",
      "accessibleName": "launch application",
      "inputMethod": "pointer",
      "expectedBefore": "application is closed",
      "expectedAfter": "eligible deterministic startup fixture shows the non-blocking surprise"
    },
    {
      "id": "scene-windows-desktop-application-regex-builders-open-anchored-regex-builder",
      "surfaceId": "windows-desktop-application",
      "featureId": "regex-builders",
      "destinationId": null,
      "status": "unreachable",
      "statusReason": "No current built artifact or runtime capture is recorded.",
      "tuple": {
        "screenId": "regex-builders",
        "state": "before-after-interaction",
        "theme": "light",
        "locale": "en-US",
        "viewportWidth": 1440,
        "viewportHeight": 900,
        "displayScale": 1,
        "route": "feature/regex-builders",
        "headlessRoute": "cheap-lowlevel-headless",
        "networkIsolation": {
          "mode": "capture-aware-disabled-network",
          "blockedExternalRequests": true,
          "allowedOrigins": [
            "loopback",
            "app-resource"
          ]
        }
      },
      "actionTarget": "regex builder affordance beside a search field",
      "accessibleName": "regex builder affordance beside a search field",
      "inputMethod": "pointer",
      "expectedBefore": "plain-text search is active",
      "expectedAfter": "the field-owned advanced builder is open and anchored"
    },
    {
      "id": "scene-windows-desktop-application-notification-centre-open-notification-centre",
      "surfaceId": "windows-desktop-application",
      "featureId": "notification-centre",
      "destinationId": null,
      "status": "unreachable",
      "statusReason": "No current built artifact or runtime capture is recorded.",
      "tuple": {
        "screenId": "notification-centre",
        "state": "before-after-interaction",
        "theme": "light",
        "locale": "en-US",
        "viewportWidth": 1440,
        "viewportHeight": 900,
        "displayScale": 1,
        "route": "feature/notification-centre",
        "headlessRoute": "cheap-lowlevel-headless",
        "networkIsolation": {
          "mode": "capture-aware-disabled-network",
          "blockedExternalRequests": true,
          "allowedOrigins": [
            "loopback",
            "app-resource"
          ]
        }
      },
      "actionTarget": "notification history action",
      "accessibleName": "notification history action",
      "inputMethod": "pointer",
      "expectedBefore": "main surface is visible",
      "expectedAfter": "reviewable notification list is open"
    },
    {